{
  "id": "l09-build-a-stool",
  "level": 9,
  "order": 1,
  "difficulty": "intermediate",
  "estMinutes": 40,
  "tags": ["project"],
  "prerequisites": ["l04-sawing-technique", "l05-butt-and-lap", "l06-glue-and-fasteners"],
  "tools": ["measuring-tape", "gunia", "handsaw", "hand-plane", "chisel-firmer", "mallet"],
  "materials": ["pine", "sheesham"],
  "hazards": ["chisel-cut", "workpiece-slip"],
  "reviewStatus": "needs-expert-review",
  "videos": [
    { "videoId": "KGEE9nvXQ2Q", "lang": "hi", "role": "primary", "credit": "SUPER WOODWORK", "verifiedAt": "2026-07-25T00:00:00Z", "embeddable": true },
    { "videoId": "lXjoCSppHFE", "lang": "en", "role": "deep-dive", "credit": "Woodworking With Wes", "verifiedAt": "2026-07-25T00:00:00Z", "embeddable": true }
  ],
  "translationStatus": { "en": "authored", "hi": "authored", "pa": "machine-draft", "bgc": "machine-draft" },
  "i18n": {
    "en": {
      "title": "Build a stool, start to finish",
      "objectives": [
        "Take a simple project from a cut-list to a finished piece",
        "Combine measuring, sawing, planing and a joint into one job",
        "Make it stand square and not wobble"
      ],
      "summary": "This is your first whole project — the moment all the separate skills become one thing you can sell or use. Work in order and don't rush the marking.",
      "steps": [
        "Make a cut-list: a seat top, four legs, and rails to join the legs. Measure twice and cut each part (L2, L4).",
        "Plane the legs straight and square, and the seat flat (L4). Mark the joints with a gunia from your reference faces.",
        "Cut the leg-to-rail joints (a half-lap or a simple mortise & tenon from L5) and dry-fit the whole frame before any glue.",
        "Check the frame is square — measure both diagonals; equal means square. Adjust, then glue and clamp (L6).",
        "Fix the seat on, plane the edges flush, sand up through the grits (L8), and finish. Stand it on a flat floor — no wobble."
      ],
      "practice": "Build one stool in pine following this order. Note where you'd change the cut-list or joints for a taller chowki next.",
      "safetyNote": "Clamp every part while sawing and paring; keep your holding hand behind the chisel and out of the saw's line (L0)."
    },
    "hi": {
      "title": "स्टूल बनाएँ, शुरू से अंत तक",
      "objectives": [
        "एक सरल प्रोजेक्ट को कट-लिस्ट से तैयार टुकड़े तक ले जाएँ",
        "नाप, आरी, रंदा और एक जोड़ को एक काम में मिलाएँ",
        "इसे चौकोर खड़ा करें, हिले नहीं"
      ],
      "summary": "यह आपका पहला पूरा प्रोजेक्ट है — जहाँ अलग-अलग कौशल एक ऐसी चीज़ बनते हैं जिसे आप बेच या इस्तेमाल कर सकें। क्रम से काम करें और निशान में जल्दबाज़ी न करें।",
      "steps": [
        "कट-लिस्ट बनाएँ: एक सीट, चार पाए, और पायों को जोड़ने वाली रेल। दो बार नापें और हर टुकड़ा काटें (L2, L4)।",
        "पायों को सीधा-चौकोर और सीट को समतल रंदें (L4)। आधार सतहों से गुनिया लगाकर जोड़ों के निशान बनाएँ।",
        "पाया-रेल जोड़ काटें (L5 का हाफ-लैप या साधारण मोर्टिस-टेनन) और गोंद से पहले पूरे फ्रेम को सूखा फिट करें।",
        "फ्रेम चौकोर है जाँचें — दोनों विकर्ण नापें; बराबर मतलब चौकोर। ठीक करके गोंद लगाकर क्लैंप करें (L6)।",
        "सीट लगाएँ, किनारे flush रंदें, ग्रिट क्रम से रेगमाल करें (L8), और फिनिश करें। समतल फर्श पर खड़ा करें — हिले नहीं।"
      ],
      "practice": "इसी क्रम से पाइन में एक स्टूल बनाएँ। नोट करें अगली बार ऊँची चौकी के लिए कट-लिस्ट या जोड़ कहाँ बदलेंगे।",
      "safetyNote": "आरी और छीलते समय हर टुकड़ा क्लैंप करें; पकड़ने वाला हाथ छेनी के पीछे और आरी की सीध से बाहर रखें (L0)।"
    },
    "pa": {
      "title": "ਸਟੂਲ ਬਣਾਓ, ਸ਼ੁਰੂ ਤੋਂ ਅੰਤ ਤੱਕ",
      "objectives": [
        "ਇੱਕ ਸਾਧਾਰਨ ਪ੍ਰੋਜੈਕਟ ਨੂੰ ਕੱਟ-ਲਿਸਟ ਤੋਂ ਤਿਆਰ ਟੁਕੜੇ ਤੱਕ ਲੈ ਜਾਓ",
        "ਨਾਪ, ਆਰੀ, ਰੰਦਾ ਤੇ ਇੱਕ ਜੋੜ ਨੂੰ ਇੱਕ ਕੰਮ ਵਿੱਚ ਮਿਲਾਓ",
        "ਇਸ ਨੂੰ ਚੌਰਸ ਖੜ੍ਹਾ ਕਰੋ, ਹਿੱਲੇ ਨਾ"
      ],
      "summary": "ਇਹ ਤੁਹਾਡਾ ਪਹਿਲਾ ਪੂਰਾ ਪ੍ਰੋਜੈਕਟ ਹੈ — ਜਿੱਥੇ ਅਲੱਗ-ਅਲੱਗ ਹੁਨਰ ਇੱਕ ਅਜਿਹੀ ਚੀਜ਼ ਬਣਦੇ ਹਨ ਜਿਸ ਨੂੰ ਤੁਸੀਂ ਵੇਚ ਜਾਂ ਵਰਤ ਸਕੋ। ਕ੍ਰਮ ਨਾਲ ਕੰਮ ਕਰੋ ਤੇ ਨਿਸ਼ਾਨ ਵਿੱਚ ਜਲਦਬਾਜ਼ੀ ਨਾ ਕਰੋ।",
      "steps": [
        "ਕੱਟ-ਲਿਸਟ ਬਣਾਓ: ਇੱਕ ਸੀਟ, ਚਾਰ ਪਾਏ, ਤੇ ਪਾਇਆਂ ਨੂੰ ਜੋੜਨ ਵਾਲੀ ਰੇਲ। ਦੋ ਵਾਰ ਨਾਪੋ ਤੇ ਹਰ ਟੁਕੜਾ ਕੱਟੋ (L2, L4)।",
        "ਪਾਇਆਂ ਨੂੰ ਸਿੱਧਾ-ਚੌਰਸ ਤੇ ਸੀਟ ਨੂੰ ਸਮਤਲ ਰੰਦੋ (L4)। ਆਧਾਰ ਸਤਹਾਂ ਤੋਂ ਗੁਨੀਆ ਲਾ ਕੇ ਜੋੜਾਂ ਦੇ ਨਿਸ਼ਾਨ ਬਣਾਓ।",
        "ਪਾਇਆ-ਰੇਲ ਜੋੜ ਕੱਟੋ (L5 ਦਾ ਹਾਫ਼-ਲੈਪ ਜਾਂ ਸਾਧਾਰਨ ਮੋਰਟਿਸ-ਟੈਨਨ) ਤੇ ਗੂੰਦ ਤੋਂ ਪਹਿਲਾਂ ਪੂਰੇ ਫ਼ਰੇਮ ਨੂੰ ਸੁੱਕਾ ਫਿੱਟ ਕਰੋ।",
        "ਫ਼ਰੇਮ ਚੌਰਸ ਹੈ ਜਾਂਚੋ — ਦੋਵੇਂ ਵਿਕਰਣ ਨਾਪੋ; ਬਰਾਬਰ ਮਤਲਬ ਚੌਰਸ। ਠੀਕ ਕਰ ਕੇ ਗੂੰਦ ਲਾ ਕੇ ਕਲੈਂਪ ਕਰੋ (L6)।",
        "ਸੀਟ ਲਾਓ, ਕਿਨਾਰੇ flush ਰੰਦੋ, ਗ੍ਰਿਟ ਕ੍ਰਮ ਨਾਲ ਰੇਗਮਾਰ ਕਰੋ (L8), ਤੇ ਫ਼ਿਨਿਸ਼ ਕਰੋ। ਸਮਤਲ ਫ਼ਰਸ਼ ਤੇ ਖੜ੍ਹਾ ਕਰੋ — ਹਿੱਲੇ ਨਾ।"
      ],
      "practice": "ਇਸੇ ਕ੍ਰਮ ਨਾਲ ਪਾਈਨ ਵਿੱਚ ਇੱਕ ਸਟੂਲ ਬਣਾਓ। ਨੋਟ ਕਰੋ ਅਗਲੀ ਵਾਰ ਉੱਚੀ ਚੌਕੀ ਲਈ ਕੱਟ-ਲਿਸਟ ਜਾਂ ਜੋੜ ਕਿੱਥੇ ਬਦਲੋਗੇ।",
      "safetyNote": "ਆਰੀ ਤੇ ਛਿੱਲਦੇ ਸਮੇਂ ਹਰ ਟੁਕੜਾ ਕਲੈਂਪ ਕਰੋ; ਫੜਨ ਵਾਲਾ ਹੱਥ ਛੈਣੀ ਦੇ ਪਿੱਛੇ ਤੇ ਆਰੀ ਦੀ ਸੇਧ ਤੋਂ ਬਾਹਰ ਰੱਖੋ (L0)।"
    },
    "bgc": {
      "title": "स्टूल बणाओ, शुरू तै अंत तक",
      "objectives": [
        "एक सरल प्रोजेक्ट नै कट-लिस्ट तै तैयार टुकड़े तक ले जाओ",
        "नाप, आरी, रंदा अर एक जोड़ नै एक काम म्ह मिलाओ",
        "इसनै चौकोर खड़ा करो, हिलै ना"
      ],
      "summary": "यो थारा पहला पूरा प्रोजेक्ट सै — जड़ै अलग-अलग हुनर एक ऐसी चीज बणैं जिसनै थम बेच या इस्तेमाल कर सको। क्रम तै काम करो अर निशान म्ह जल्दबाजी ना करो।",
      "steps": [
        "कट-लिस्ट बणाओ: एक सीट, चार पाए, अर पायां नै जोड़ण आळी रेल। दो बार नापो अर हर टुकड़ा काटो (L2, L4)।",
        "पायां नै सीधा-चौकोर अर सीट नै समतल रंदो (L4)। आधार सतहां तै गुनिया लगाकै जोड़ां कै निशान बणाओ।",
        "पाया-रेल जोड़ काटो (L5 का हाफ-लैप या साधारण मोर्टिस-टेनन) अर गोंद तै पहलम पूरे फ्रेम नै सूखा फिट करो।",
        "फ्रेम चौकोर सै जांचो — दोनूँ विकर्ण नापो; बराबर मतलब चौकोर। ठीक करकै गोंद लगाकै क्लैंप करो (L6)।",
        "सीट लगाओ, किनारे flush रंदो, ग्रिट क्रम तै रेगमाल करो (L8), अर फिनिश करो। समतल फर्श पै खड़ा करो — हिलै ना।"
      ],
      "practice": "इसी क्रम तै पाइन म्ह एक स्टूल बणाओ। नोट करो अगली बार ऊंची चौकी खातर कट-लिस्ट या जोड़ कड़ै बदलोगे।",
      "safetyNote": "आरी अर छीलते बखत हर टुकड़ा क्लैंप करो; पकड़ण आळा हाथ छेनी कै पाच्छै अर आरी की सीध तै बाहर राखो (L0)।"
    }
  },
  "selfCheck": [
    {
      "q": {
        "en": "Before gluing the frame, how do you check it's square?",
        "hi": "फ्रेम को गोंद लगाने से पहले चौकोर कैसे जाँचें?",
        "pa": "ਫ਼ਰੇਮ ਨੂੰ ਗੂੰਦ ਲਾਉਣ ਤੋਂ ਪਹਿਲਾਂ ਚੌਰਸ ਕਿਵੇਂ ਜਾਂਚੋ?",
        "bgc": "फ्रेम नै गोंद लगाण तै पहलम चौकोर किस तरां जांचो?"
      },
      "options": [
        { "en": "Look at it from the front", "hi": "सामने से देखें", "pa": "ਸਾਹਮਣੇ ਤੋਂ ਵੇਖੋ", "bgc": "सामने तै देखो" },
        { "en": "Measure both diagonals — equal means square", "hi": "दोनों विकर्ण नापें — बराबर मतलब चौकोर", "pa": "ਦੋਵੇਂ ਵਿਕਰਣ ਨਾਪੋ — ਬਰਾਬਰ ਮਤਲਬ ਚੌਰਸ", "bgc": "दोनूँ विकर्ण नापो — बराबर मतलब चौकोर" },
        { "en": "Push on it hard", "hi": "इस पर ज़ोर से दबाएँ", "pa": "ਇਸ ਤੇ ਜ਼ੋਰ ਨਾਲ ਦਬਾਓ", "bgc": "इस पै जोर तै दबाओ" }
      ],
      "answerIndex": 1,
      "explain": {
        "en": "Equal diagonals prove a rectangle is square — the quickest reliable check before the glue sets.",
        "hi": "बराबर विकर्ण साबित करते हैं कि आयत चौकोर है — गोंद जमने से पहले सबसे तेज़ भरोसेमंद जाँच।",
        "pa": "ਬਰਾਬਰ ਵਿਕਰਣ ਸਾਬਤ ਕਰਦੇ ਹਨ ਕਿ ਆਇਤ ਚੌਰਸ ਹੈ — ਗੂੰਦ ਜੰਮਣ ਤੋਂ ਪਹਿਲਾਂ ਸਭ ਤੋਂ ਤੇਜ਼ ਭਰੋਸੇਯੋਗ ਜਾਂਚ।",
        "bgc": "बराबर विकर्ण साबित करैं के आयत चौकोर सै — गोंद जमण तै पहलम सबतै तेज भरोसेमंद जांच।"
      }
    }
  ]
}
