{
  "id": "l05-butt-and-lap",
  "level": 5,
  "order": 1,
  "difficulty": "intermediate",
  "tags": ["joinery"],
  "estMinutes": 18,
  "prerequisites": ["l04-sawing-technique"],
  "tools": ["handsaw", "chisel-firmer", "gunia", "marking-gauge"],
  "materials": ["pine"],
  "hazards": ["chisel-cut", "workpiece-slip"],
  "reviewStatus": "needs-expert-review",
  "videos": [
    { "videoId": "LVfQmRu5Igg", "lang": "en", "role": "primary", "credit": "BCDesign", "verifiedAt": "2026-07-25T00:00:00Z", "embeddable": true },
    { "videoId": "B1A3aiEHIzk", "lang": "en", "role": "deep-dive", "credit": "Make Something", "verifiedAt": "2026-07-25T00:00:00Z", "embeddable": true }
  ],
  "translationStatus": { "en": "authored", "hi": "authored", "pa": "machine-draft", "bgc": "machine-draft" },
  "i18n": {
    "en": {
      "title": "Butt & half-lap joints",
      "objectives": [
        "Make a square, reinforced butt joint",
        "Cut a half-lap so both faces sit flush",
        "Test-fit before glue every time"
      ],
      "summary": "The butt joint is the simplest join; the half-lap is the first 'real' joint where the parts interlock. Master these two and most frames are within reach.",
      "steps": [
        "Butt joint: square both mating ends with a gunia so they meet with no gap. A plain butt is weak — reinforce it with glue plus screws or dowels.",
        "Half-lap: set a marking gauge to half the stock thickness and scribe the cheek line on both pieces from the same face.",
        "Saw down the shoulder lines to the gauge line, on the waste side.",
        "Pare the cheek away with a chisel, working to the gauge line until flat — check with a gunia.",
        "Dry-fit the two halves: the faces should sit flush and square. Adjust, then glue and clamp."
      ],
      "practice": "Cut one butt joint (glued + 2 screws) and one half-lap in pine. Try to pull each apart by hand — feel how much stronger the interlocking lap is.",
      "safetyNote": "When paring, clamp the work and keep both hands behind the chisel edge — never pare toward your holding hand."
    },
    "hi": {
      "title": "बट और हाफ-लैप जोड़",
      "objectives": [
        "चौकोर, मज़बूत किया हुआ बट जोड़ बनाएँ",
        "हाफ-लैप ऐसा काटें कि दोनों सतहें एक-सी (flush) बैठें",
        "गोंद से पहले हर बार फिट करके देखें"
      ],
      "summary": "बट सबसे सरल जोड़ है; हाफ-लैप पहला 'असली' जोड़ है जहाँ टुकड़े आपस में फँसते हैं। ये दो आ गए तो ज़्यादातर फ्रेम पहुँच में हैं।",
      "steps": [
        "बट जोड़: दोनों मिलने वाले सिरे गुनिया से चौकोर करें ताकि बिना गैप मिलें। सादा बट कमज़ोर है — गोंद के साथ पेंच या डौवल से मज़बूत करें।",
        "हाफ-लैप: मार्किंग गेज को मोटाई के आधे पर सेट करें और दोनों टुकड़ों पर एक ही सतह से चीक-लाइन खींचें।",
        "शोल्डर लकीरों तक गेज-लाइन तक, बेकार तरफ आरी चलाएँ।",
        "छेनी से चीक हटाएँ, गेज-लाइन तक समतल करते हुए — गुनिया से जाँचें।",
        "दोनों हिस्से सूखे फिट करें: सतहें एक-सी और चौकोर बैठें। ठीक करके गोंद लगाकर क्लैंप करें।"
      ],
      "practice": "पाइन में एक बट जोड़ (गोंद + 2 पेंच) और एक हाफ-लैप काटें। दोनों को हाथ से खींचकर देखें — फँसने वाला लैप कितना ज़्यादा मज़बूत है, महसूस करें।",
      "safetyNote": "छीलते समय काम क्लैंप करें और दोनों हाथ छेनी की धार के पीछे रखें — कभी पकड़ने वाले हाथ की तरफ न छीलें।"
    },
    "pa": {
      "title": "ਬੱਟ ਤੇ ਹਾਫ਼-ਲੈਪ ਜੋੜ",
      "objectives": [
        "ਚੌਰਸ, ਮਜ਼ਬੂਤ ਕੀਤਾ ਹੋਇਆ ਬੱਟ ਜੋੜ ਬਣਾਓ",
        "ਹਾਫ਼-ਲੈਪ ਇੰਝ ਕੱਟੋ ਕਿ ਦੋਵੇਂ ਸਤਹਾਂ ਇੱਕੋ ਜਿਹੀਆਂ (flush) ਬੈਠਣ",
        "ਗੂੰਦ ਤੋਂ ਪਹਿਲਾਂ ਹਰ ਵਾਰ ਫਿੱਟ ਕਰ ਕੇ ਵੇਖੋ"
      ],
      "summary": "ਬੱਟ ਸਭ ਤੋਂ ਸਾਧਾਰਨ ਜੋੜ ਹੈ; ਹਾਫ਼-ਲੈਪ ਪਹਿਲਾ 'ਅਸਲੀ' ਜੋੜ ਹੈ ਜਿੱਥੇ ਟੁਕੜੇ ਆਪਸ ਵਿੱਚ ਫਸਦੇ ਹਨ। ਇਹ ਦੋ ਆ ਗਏ ਤਾਂ ਜ਼ਿਆਦਾਤਰ ਫ਼ਰੇਮ ਪਹੁੰਚ ਵਿੱਚ ਹਨ।",
      "steps": [
        "ਬੱਟ ਜੋੜ: ਦੋਵੇਂ ਮਿਲਣ ਵਾਲੇ ਸਿਰੇ ਗੁਨੀਆ ਨਾਲ ਚੌਰਸ ਕਰੋ ਤਾਂ ਜੋ ਬਿਨਾਂ ਗੈਪ ਮਿਲਣ। ਸਾਦਾ ਬੱਟ ਕਮਜ਼ੋਰ ਹੈ — ਗੂੰਦ ਦੇ ਨਾਲ ਪੇਚ ਜਾਂ ਡੌਵਲ ਨਾਲ ਮਜ਼ਬੂਤ ਕਰੋ।",
        "ਹਾਫ਼-ਲੈਪ: ਮਾਰਕਿੰਗ ਗੇਜ ਨੂੰ ਮੋਟਾਈ ਦੇ ਅੱਧ ਤੇ ਸੈੱਟ ਕਰੋ ਤੇ ਦੋਵਾਂ ਟੁਕੜਿਆਂ ਤੇ ਇੱਕੋ ਸਤਹ ਤੋਂ ਚੀਕ-ਲਾਈਨ ਖਿੱਚੋ।",
        "ਸ਼ੋਲਡਰ ਲਕੀਰਾਂ ਤੱਕ ਗੇਜ-ਲਾਈਨ ਤੱਕ, ਬੇਕਾਰ ਪਾਸੇ ਆਰੀ ਚਲਾਓ।",
        "ਛੈਣੀ ਨਾਲ ਚੀਕ ਹਟਾਓ, ਗੇਜ-ਲਾਈਨ ਤੱਕ ਸਮਤਲ ਕਰਦੇ ਹੋਏ — ਗੁਨੀਆ ਨਾਲ ਜਾਂਚੋ।",
        "ਦੋਵੇਂ ਹਿੱਸੇ ਸੁੱਕੇ ਫਿੱਟ ਕਰੋ: ਸਤਹਾਂ ਇੱਕੋ ਜਿਹੀਆਂ ਤੇ ਚੌਰਸ ਬੈਠਣ। ਠੀਕ ਕਰ ਕੇ ਗੂੰਦ ਲਾ ਕੇ ਕਲੈਂਪ ਕਰੋ।"
      ],
      "practice": "ਪਾਈਨ ਵਿੱਚ ਇੱਕ ਬੱਟ ਜੋੜ (ਗੂੰਦ + 2 ਪੇਚ) ਤੇ ਇੱਕ ਹਾਫ਼-ਲੈਪ ਕੱਟੋ। ਦੋਵਾਂ ਨੂੰ ਹੱਥ ਨਾਲ ਖਿੱਚ ਕੇ ਵੇਖੋ — ਫਸਣ ਵਾਲਾ ਲੈਪ ਕਿੰਨਾ ਵੱਧ ਮਜ਼ਬੂਤ ਹੈ, ਮਹਿਸੂਸ ਕਰੋ।",
      "safetyNote": "ਛਿੱਲਦੇ ਸਮੇਂ ਕੰਮ ਕਲੈਂਪ ਕਰੋ ਤੇ ਦੋਵੇਂ ਹੱਥ ਛੈਣੀ ਦੀ ਧਾਰ ਦੇ ਪਿੱਛੇ ਰੱਖੋ — ਕਦੇ ਫੜਨ ਵਾਲੇ ਹੱਥ ਵੱਲ ਨਾ ਛਿੱਲੋ।"
    },
    "bgc": {
      "title": "बट अर हाफ-लैप जोड़",
      "objectives": [
        "चौकोर, मजबूत कर्या होया बट जोड़ बणाओ",
        "हाफ-लैप इस तरां काटो के दोनूँ सतह एकैसी (flush) बैठैं",
        "गोंद तै पहलम हर बार फिट करकै देखो"
      ],
      "summary": "बट सबतै सरल जोड़ सै; हाफ-लैप पहला 'असली' जोड़ सै जड़ै टुकड़े आपस म्ह फंसैं। ये दो आ गए तो घणे फ्रेम पौंच म्ह सैं।",
      "steps": [
        "बट जोड़: दोनूँ मिलण आळे सिरे गुनिया तै चौकोर करो ताके बिना गैप मिलैं। सादा बट कमजोर सै — गोंद कै गेल्यां पेंच या डौवल तै मजबूत करो।",
        "हाफ-लैप: मार्किंग गेज नै मोटाई कै आधे पै सेट करो अर दोनूँ टुकड़ां पै एकैए सतह तै चीक-लाइन खींचो।",
        "शोल्डर लकीरां तक गेज-लाइन तक, बेकार पासै आरी चलाओ।",
        "छेनी तै चीक हटाओ, गेज-लाइन तक समतल करते होए — गुनिया तै जांचो।",
        "दोनूँ हिस्से सूखे फिट करो: सतह एकैसी अर चौकोर बैठैं। ठीक करकै गोंद लगाकै क्लैंप करो।"
      ],
      "practice": "पाइन म्ह एक बट जोड़ (गोंद + 2 पेंच) अर एक हाफ-लैप काटो। दोनूँ नै हाथ तै खींचकै देखो — फंसण आळा लैप कितना घणा मजबूत सै, महसूस करो।",
      "safetyNote": "छीलते बखत काम क्लैंप करो अर दोनूँ हाथ छेनी की धार कै पाच्छै राखो — कदे पकड़ण आळे हाथ कान्नी ना छीलो।"
    }
  },
  "selfCheck": [
    {
      "q": {
        "en": "To what depth do you cut each half of a half-lap joint?",
        "hi": "हाफ-लैप जोड़ के हर हिस्से को कितनी गहराई तक काटते हैं?",
        "pa": "ਹਾਫ਼-ਲੈਪ ਜੋੜ ਦੇ ਹਰ ਹਿੱਸੇ ਨੂੰ ਕਿੰਨੀ ਗਹਿਰਾਈ ਤੱਕ ਕੱਟਦੇ ਹਾਂ?",
        "bgc": "हाफ-लैप जोड़ कै हर हिस्से नै कितनी गहराई तक काटैं सैं?"
      },
      "options": [
        { "en": "The full thickness", "hi": "पूरी मोटाई", "pa": "ਪੂਰੀ ਮੋਟਾਈ", "bgc": "पूरी मोटाई" },
        { "en": "Half the thickness", "hi": "आधी मोटाई", "pa": "ਅੱਧੀ ਮੋਟਾਈ", "bgc": "आधी मोटाई" },
        { "en": "A quarter of the thickness", "hi": "मोटाई का एक-चौथाई", "pa": "ਮੋਟਾਈ ਦਾ ਇੱਕ-ਚੌਥਾਈ", "bgc": "मोटाई का एक-चौथाई" }
      ],
      "answerIndex": 1,
      "explain": {
        "en": "Each piece loses half its thickness, so together the faces end up flush.",
        "hi": "हर टुकड़ा आधी मोटाई खोता है, इसलिए मिलकर सतहें एक-सी बैठती हैं।",
        "pa": "ਹਰ ਟੁਕੜਾ ਅੱਧੀ ਮੋਟਾਈ ਖੋਂਦਾ ਹੈ, ਇਸ ਲਈ ਮਿਲ ਕੇ ਸਤਹਾਂ ਇੱਕੋ ਜਿਹੀਆਂ ਬੈਠਦੀਆਂ ਹਨ।",
        "bgc": "हर टुकड़ा आधी मोटाई खोवै, इस खातर मिलकै सतह एकैसी बैठैं।"
      }
    }
  ]
}
