{
  "id": "l05-mortise-tenon",
  "level": 5,
  "order": 2,
  "difficulty": "intermediate",
  "estMinutes": 30,
  "tags": ["joinery"],
  "prerequisites": ["l05-butt-and-lap"],
  "tools": ["chisel-firmer", "mallet", "tenon-saw", "marking-gauge"],
  "materials": ["sheesham"],
  "hazards": ["chisel-cut", "workpiece-slip"],
  "reviewStatus": "needs-expert-review",
  "videos": [
    { "videoId": "aBodzmUGtdw", "lang": "en", "role": "primary", "credit": "Paul Sellers", "verifiedAt": "2026-07-25T00:00:00Z", "embeddable": true }
  ],
  "translationStatus": { "en": "authored", "hi": "authored", "pa": "machine-draft", "bgc": "machine-draft" },
  "i18n": {
    "en": {
      "title": "Mortise & tenon",
      "objectives": [
        "Mark a matching mortise and tenon from the same gauge setting",
        "Chop a clean, square mortise",
        "Saw a tenon that fits snug — not forced, not loose"
      ],
      "summary": "The mortise and tenon is the strongest everyday frame joint — beds, doors, chairs all rely on it. It rewards careful marking more than force.",
      "steps": [
        "Set the marking gauge to about one-third of the stock thickness and mark the tenon on the rail from the face side.",
        "Without changing the gauge, mark the mortise on the leg from its face side — this guarantees they match.",
        "Chop the mortise: start in the middle, drive the chisel with a mallet, and work out toward the ends, taking small bites. Lever waste out; keep the walls square.",
        "Saw the tenon cheeks and shoulders on the waste side of your lines; pare to the line if needed.",
        "Dry-fit: the tenon should push home with hand pressure and stay put — snug, not hammered. Then glue and clamp square (check diagonals)."
      ],
      "practice": "Cut one mortise and tenon in sheesham. Aim for a fit you can push together by hand that doesn't fall apart when you lift it. If it's loose, glue in a veneer shim on the tenon.",
      "safetyNote": "Chopping a mortise sends the chisel down with force — clamp the leg, keep your holding hand behind the chisel, and never steady the work in the line of the cut."
    },
    "hi": {
      "title": "मोर्टिस और टेनन",
      "objectives": [
        "एक ही गेज सेटिंग से मिलते-जुलते मोर्टिस और टेनन के निशान लगाएँ",
        "साफ, चौकोर मोर्टिस काटें (चॉप करें)",
        "टेनन ऐसा काटें जो कसकर बैठे — न ठुँका हुआ, न ढीला"
      ],
      "summary": "मोर्टिस-टेनन रोज़ के फ्रेम का सबसे मज़बूत जोड़ है — पलंग, दरवाज़े, कुर्सियाँ सब इसी पर टिके हैं। यह ज़ोर से ज़्यादा सावधान निशान माँगता है।",
      "steps": [
        "मार्किंग गेज को मोटाई के लगभग एक-तिहाई पर सेट करें और रेल पर फेस साइड से टेनन के निशान लगाएँ।",
        "गेज बदले बिना, पाए (leg) पर उसी फेस साइड से मोर्टिस के निशान लगाएँ — इससे दोनों मिलते हैं।",
        "मोर्टिस चॉप करें: बीच से शुरू करें, छेनी को मैलेट से चलाएँ, छोटे-छोटे टुकड़े लेते हुए किनारों की तरफ बढ़ें। बेकार निकालें; दीवारें चौकोर रखें।",
        "टेनन की चीक और शोल्डर लकीरों के बेकार तरफ आरी चलाएँ; ज़रूरत हो तो लकीर तक छीलें।",
        "सूखा फिट करें: टेनन हाथ के दबाव से अंदर जाए और टिका रहे — कसा हुआ, ठोका हुआ नहीं। फिर गोंद लगाकर चौकोर क्लैंप करें (विकर्ण जाँचें)।"
      ],
      "practice": "शीशम में एक मोर्टिस-टेनन काटें। ऐसा फिट लक्ष्य रखें जो हाथ से जुड़ जाए और उठाने पर अलग न हो। ढीला हो तो टेनन पर विनियर की पतली फाँक चिपकाएँ।",
      "safetyNote": "मोर्टिस चॉप करने में छेनी ज़ोर से नीचे जाती है — पाया क्लैंप करें, पकड़ने वाला हाथ छेनी के पीछे रखें, और कटाई की सीध में काम न थामें।"
    },
    "pa": {
      "title": "ਮੋਰਟਿਸ ਤੇ ਟੈਨਨ",
      "objectives": [
        "ਇੱਕੋ ਗੇਜ ਸੈਟਿੰਗ ਤੋਂ ਮਿਲਦੇ-ਜੁਲਦੇ ਮੋਰਟਿਸ ਤੇ ਟੈਨਨ ਦੇ ਨਿਸ਼ਾਨ ਲਾਓ",
        "ਸਾਫ਼, ਚੌਰਸ ਮੋਰਟਿਸ ਕੱਟੋ (ਚੌਪ ਕਰੋ)",
        "ਟੈਨਨ ਇੰਝ ਕੱਟੋ ਜੋ ਕੱਸ ਕੇ ਬੈਠੇ — ਨਾ ਠੁਕਿਆ ਹੋਇਆ, ਨਾ ਢਿੱਲਾ"
      ],
      "summary": "ਮੋਰਟਿਸ-ਟੈਨਨ ਰੋਜ਼ ਦੇ ਫ਼ਰੇਮ ਦਾ ਸਭ ਤੋਂ ਮਜ਼ਬੂਤ ਜੋੜ ਹੈ — ਪਲੰਘ, ਦਰਵਾਜ਼ੇ, ਕੁਰਸੀਆਂ ਸਭ ਇਸੇ ਤੇ ਟਿਕੇ ਹਨ। ਇਹ ਜ਼ੋਰ ਤੋਂ ਵੱਧ ਸਾਵਧਾਨ ਨਿਸ਼ਾਨ ਮੰਗਦਾ ਹੈ।",
      "steps": [
        "ਮਾਰਕਿੰਗ ਗੇਜ ਨੂੰ ਮੋਟਾਈ ਦੇ ਲਗਭਗ ਇੱਕ-ਤਿਹਾਈ ਤੇ ਸੈੱਟ ਕਰੋ ਤੇ ਰੇਲ ਤੇ ਫੇਸ ਸਾਈਡ ਤੋਂ ਟੈਨਨ ਦੇ ਨਿਸ਼ਾਨ ਲਾਓ।",
        "ਗੇਜ ਬਦਲੇ ਬਿਨਾਂ, ਪਾਏ (leg) ਤੇ ਉਸੇ ਫੇਸ ਸਾਈਡ ਤੋਂ ਮੋਰਟਿਸ ਦੇ ਨਿਸ਼ਾਨ ਲਾਓ — ਇਸ ਨਾਲ ਦੋਵੇਂ ਮਿਲਦੇ ਹਨ।",
        "ਮੋਰਟਿਸ ਚੌਪ ਕਰੋ: ਵਿਚਕਾਰੋਂ ਸ਼ੁਰੂ ਕਰੋ, ਛੈਣੀ ਨੂੰ ਮੈਲਟ ਨਾਲ ਚਲਾਓ, ਛੋਟੇ-ਛੋਟੇ ਟੁਕੜੇ ਲੈਂਦੇ ਹੋਏ ਕਿਨਾਰਿਆਂ ਵੱਲ ਵਧੋ। ਬੇਕਾਰ ਕੱਢੋ; ਕੰਧਾਂ ਚੌਰਸ ਰੱਖੋ।",
        "ਟੈਨਨ ਦੀ ਚੀਕ ਤੇ ਸ਼ੋਲਡਰ ਲਕੀਰਾਂ ਦੇ ਬੇਕਾਰ ਪਾਸੇ ਆਰੀ ਚਲਾਓ; ਲੋੜ ਹੋਵੇ ਤਾਂ ਲਕੀਰ ਤੱਕ ਛਿੱਲੋ।",
        "ਸੁੱਕਾ ਫਿੱਟ ਕਰੋ: ਟੈਨਨ ਹੱਥ ਦੇ ਦਬਾਅ ਨਾਲ ਅੰਦਰ ਜਾਵੇ ਤੇ ਟਿਕਿਆ ਰਹੇ — ਕੱਸਿਆ ਹੋਇਆ, ਠੋਕਿਆ ਹੋਇਆ ਨਹੀਂ। ਫਿਰ ਗੂੰਦ ਲਾ ਕੇ ਚੌਰਸ ਕਲੈਂਪ ਕਰੋ (ਵਿਕਰਣ ਜਾਂਚੋ)।"
      ],
      "practice": "ਸ਼ੀਸ਼ਮ ਵਿੱਚ ਇੱਕ ਮੋਰਟਿਸ-ਟੈਨਨ ਕੱਟੋ। ਅਜਿਹਾ ਫਿੱਟ ਰੱਖੋ ਜੋ ਹੱਥ ਨਾਲ ਜੁੜ ਜਾਵੇ ਤੇ ਚੁੱਕਣ ਤੇ ਅਲੱਗ ਨਾ ਹੋਵੇ। ਢਿੱਲਾ ਹੋਵੇ ਤਾਂ ਟੈਨਨ ਤੇ ਵਿਨੀਅਰ ਦੀ ਪਤਲੀ ਫਾਂਕ ਚਿਪਕਾਓ।",
      "safetyNote": "ਮੋਰਟਿਸ ਚੌਪ ਕਰਨ ਵਿੱਚ ਛੈਣੀ ਜ਼ੋਰ ਨਾਲ ਹੇਠਾਂ ਜਾਂਦੀ ਹੈ — ਪਾਇਆ ਕਲੈਂਪ ਕਰੋ, ਫੜਨ ਵਾਲਾ ਹੱਥ ਛੈਣੀ ਦੇ ਪਿੱਛੇ ਰੱਖੋ, ਤੇ ਕਟਾਈ ਦੀ ਸੇਧ ਵਿੱਚ ਕੰਮ ਨਾ ਥੰਮੋ।"
    },
    "bgc": {
      "title": "मोर्टिस अर टेनन",
      "objectives": [
        "एकैए गेज सेटिंग तै मिलते-जुलते मोर्टिस अर टेनन कै निशान लगाओ",
        "साफ, चौकोर मोर्टिस काटो (चॉप करो)",
        "टेनन इस तरां काटो जो कसकै बैठै — ना ठुक्या होया, ना ढीला"
      ],
      "summary": "मोर्टिस-टेनन रोज कै फ्रेम का सबतै मजबूत जोड़ सै — पलंग, दरवाजे, कुर्सियां सब इसी पै टिकैं सैं। यो जोर तै घणा सावधान निशान मांगै।",
      "steps": [
        "मार्किंग गेज नै मोटाई कै लगभग एक-तिहाई पै सेट करो अर रेल पै फेस साइड तै टेनन कै निशान लगाओ।",
        "गेज बदले बिना, पाए (leg) पै वोए फेस साइड तै मोर्टिस कै निशान लगाओ — इसतै दोनूँ मिलैं।",
        "मोर्टिस चॉप करो: बिचाळै तै शुरू करो, छेनी नै मैलेट तै चलाओ, छोटे-छोटे टुकड़े लेते होए किनारां कान्नी बढ़ो। बेकार काढ़ो; दीवारां चौकोर राखो।",
        "टेनन की चीक अर शोल्डर लकीरां कै बेकार पासै आरी चलाओ; जरूरत हो तो लकीर तक छीलो।",
        "सूखा फिट करो: टेनन हाथ कै दबाव तै अंदर जावै अर टिक्या रहवै — कस्या होया, ठोक्या होया ना। फेर गोंद लगाकै चौकोर क्लैंप करो (विकर्ण जांचो)।"
      ],
      "practice": "शीशम म्ह एक मोर्टिस-टेनन काटो। ऐसा फिट राखो जो हाथ तै जुड़ ज्या अर उठाण पै अलग ना हो। ढीला हो तो टेनन पै विनियर की पतली फांक चिपकाओ।",
      "safetyNote": "मोर्टिस चॉप करण म्ह छेनी जोर तै नीचे जावै — पाया क्लैंप करो, पकड़ण आळा हाथ छेनी कै पाच्छै राखो, अर कटाई की सीध म्ह काम ना थामो।"
    }
  },
  "selfCheck": [
    {
      "q": {
        "en": "A good tenon fit should be…",
        "hi": "अच्छा टेनन फिट कैसा होना चाहिए…",
        "pa": "ਵਧੀਆ ਟੈਨਨ ਫਿੱਟ ਕਿਹੋ ਜਿਹਾ ਹੋਣਾ ਚਾਹੀਦਾ ਹੈ…",
        "bgc": "बढ़िया टेनन फिट कैसा होणा चाहिए…"
      },
      "options": [
        { "en": "So tight you hammer it in", "hi": "इतना कसा कि हथौड़े से ठोकना पड़े", "pa": "ਇੰਨਾ ਕੱਸਿਆ ਕਿ ਹਥੌੜੇ ਨਾਲ ਠੋਕਣਾ ਪਵੇ", "bgc": "इतना कस्या के हथौड़े तै ठोकणा पड़ै" },
        { "en": "Snug — pushes in by hand and stays", "hi": "कसा हुआ — हाथ से अंदर जाए और टिका रहे", "pa": "ਕੱਸਿਆ ਹੋਇਆ — ਹੱਥ ਨਾਲ ਅੰਦਰ ਜਾਵੇ ਤੇ ਟਿਕਿਆ ਰਹੇ", "bgc": "कस्या होया — हाथ तै अंदर जावै अर टिक्या रहवै" },
        { "en": "Loose so glue fills the gap", "hi": "ढीला ताकि गोंद गैप भरे", "pa": "ਢਿੱਲਾ ਤਾਂ ਜੋ ਗੂੰਦ ਗੈਪ ਭਰੇ", "bgc": "ढीला ताके गोंद गैप भरै" }
      ],
      "answerIndex": 1,
      "explain": {
        "en": "Hammered-in joints split the wood; loose joints rely on glue alone and fail. Snug is strongest.",
        "hi": "ठोका जोड़ लकड़ी फाड़ता है; ढीला सिर्फ गोंद पर टिकता है और टूटता है। कसा हुआ सबसे मज़बूत।",
        "pa": "ਠੋਕੇ ਜੋੜ ਲੱਕੜ ਫਾੜਦੇ ਹਨ; ਢਿੱਲੇ ਸਿਰਫ਼ ਗੂੰਦ ਤੇ ਟਿਕਦੇ ਤੇ ਟੁੱਟਦੇ ਹਨ। ਕੱਸਿਆ ਹੋਇਆ ਸਭ ਤੋਂ ਮਜ਼ਬੂਤ।",
        "bgc": "ठोक्या जोड़ लकड़ी फाड़ै; ढीला सिर्फ गोंद पै टिकै अर टूटै। कस्या होया सबतै मजबूत।"
      }
    }
  ]
}
